{
  "schema_version": 1,
  "benchmark_id": "adversarial-policy",
  "layer": "memory_system_capability",
  "version": "v2",
  "created_at_epoch": 1760000000,
  "source_policy": {
    "private_user_memory_allowed": false,
    "requires_temp_remem_data_dir": true,
    "external_dataset_revision": null
  },
  "conditions": [
    "remem_default"
  ],
  "reports": [
    "memory/reports/adversarial-policy-v2-x86_64-apple-darwin.json"
  ]
}
